2025-03-27 20:15:42,아스피린 부작용 나열해줘,"아스피린에 대한 정보는 다음과 같습니다:

1. 약품명: 아스피린
2. 효능/효과: 아스피린은 일반적으로 통증 완화, 열을 낮추는 항열제, 염증 감소, 그리고 혈전 생성을 방지하는 데 사용됩니다. 특히 심혈관 질환의 예방과 치료에도 쓰입니다.
3. 사용법: 아스피린의 사용법은 질환의 유형과 환자의 상태에 따라 다릅니다. 일반적으로, 성인은 통증이나 발열을 줄이기 위해 4~6시간마다 300~600mg을 경구 투여하며, 심혈관 질환 예방을 위해서는 매일 저용량(75~325mg)을 사용합니다. 정확한 용량과 사용법은 의사의 지시를 따라야 합니다.
4. 주의사항: 아스피린은 위장 관련 문제(예: 위궤양), 출혈 장애, 아스피린 알레르기 또는 기타 비스테로이드성 항염증제(NSAIDs)에 대한 알레르기가 있는 환자에게는 주의하여 사용해야 합니다. 또한 임신 말기에는 태아에게 부정적인 영향을 줄 수 있으므로 사용을 피해야 합니다.
5. 부작용: 아스피린의 부작용으로는 위장 장애, 소화 불량, 위 출혈, 알레르기 반응(예: 발진, 호흡곤란), 간 기능 장애, 청력 손실 또는 이명 등이 있습니다. 또한, 출혈 시간을 연장시킬 수 있습니다.
6. 상호작용: 아스피린은 다른 비스테로이드성 항염증제(NSAIDs), 항응고제(예: 와파린), 일부 항우울제(예: SSRIs), 알코올 등과 상호작용할 수 있으며, 이러한 상호작용은 출혈 위험을 증가시킬 수 있습니다. 다른 약물을 복용 중인 경우, 아스피린 사용 전에 의사 또는 약사와 상의해야 합니다.",
